{
    "QuestName": "Anesthesia",
    "Locations": [
        "shoreline"
    ],
    "Kappa": true,
    "LeadsTo": [
        "Rigged Game",
        "Samples",
        "Chemistry Closet"
    ],
    "Requirements": {
        "Level": 21,
        "Quests": [
            "Shaking Up The Teller"
        ]
    },
    "Objectives": [
        {
            "ID": 1,
            "Required": true,
            "Location": "shoreline",
            "LocationBoxTopLeft": [
                403,
                486
            ],
            "LocationBoxBottomRight": [
                406,
                491
            ],
            "Type": "mark",
            "Time": [
                0.0,
                0.0
            ],
            "Target": "first trading post",
            "Amount": 1
        },
        {
            "ID": 2,
            "Required": true,
            "Location": "shoreline",
            "LocationBoxTopLeft": [
                218,
                616
            ],
            "LocationBoxBottomRight": [
                225,
                622
            ],
            "Type": "mark",
            "Time": [
                0.0,
                0.0
            ],
            "Target": "second trading post",
            "Amount": 1
        },
        {
            "ID": 3,
            "Required": true,
            "Location": "shoreline",
            "LocationBoxTopLeft": [
                427,
                902
            ],
            "LocationBoxBottomRight": [
                430,
                908
            ],
            "Type": "mark",
            "Time": [
                0.0,
                0.0
            ],
            "Target": "third trading post",
            "Amount": 1
        },
        {
            "ID": 4,
            "Required": true,
            "Location": "shoreline",
            "LocationBoxTopLeft": [
                0,
                0
            ],
            "LocationBoxBottomRight": [
                0,
                0
            ],
            "Type": "survive",
            "Time": [
                0.0,
                0.0
            ],
            "Target": "shoreline raid",
            "Amount": 1
        }
    ],
    "Rewards": [
        {
            "Name": "xp",
            "Amount": 18100
        },
        {
            "Name": "Prapor rep",
            "Amount": 0.04
        },
        {
            "Name": "Roubles",
            "Amount": 50000
        },
        {
            "Name": "AS VAL",
            "Amount": 1
        },
        {
            "Name": "9x39 SPP ammo pack (20 rounds)",
            "Amount": 5
        },
        {
            "Name": "9x39 SP ammo pack (20 rounds)",
            "Amount": 5
        }
    ]
}
