{
    "QuestName": "Shaking Up The Teller",
    "Locations": [
        "any"
    ],
    "Kappa": true,
    "LeadsTo": [
        "The Punisher - Part 1",
        "Perfect Mediator",
        "Anethesia"
    ],
    "Requirements": {
        "Level": 10,
        "Quests": [
            "Ice Cream Cones"
        ]
    },
    "Objectives": [
        {
            "ID": 1,
            "Required": true,
            "Location": "customs",
            "LocationBoxTopLeft": [
                85,
                78
            ],
            "LocationBoxBottomRight": [
                87,
                80
            ],
            "Type": "fetch",
            "Time": [
                0.0,
                0.0
            ],
            "Target": "bank case",
            "Amount": 1
        },
        {
            "ID": 2,
            "Required": false,
            "Location": "any",
            "LocationBoxTopLeft": [
                0,
                0
            ],
            "LocationBoxBottomRight": [
                0,
                0
            ],
            "Type": "gather",
            "Time": [
                0.0,
                0.0
            ],
            "Target": "dorm room 203 key",
            "Amount": 1
        }
    ],
    "Rewards": [
        {
            "Name": "xp",
            "Amount": 5900
        },
        {
            "Name": "Prapor rep",
            "Amount": 0.02
        },
        {
            "Name": "Roubles",
            "Amount": 75000
        },
        {
            "Name": "Geiger counter",
            "Amount": 1
        },
        {
            "Name": "Purchase of AKS-74U PBS-4 suppressor from prapor lvl 3",
            "Amount": 1
        },
        {
            "Name": "Purchase of Hexagon 12k suppressor from skier lvl 2",
            "Amount": 1
        }
    ]
}
