{
    "QuestName": "Test Drive - Part 3",
    "Locations": [
        "lighthouse"
    ],
    "Kappa": true,
    "Requirements": {
        "Level": 30,
        "Quests": [
            "Test Drive - Part 2"
        ]
    },
    "LeadsTo": [
        "Test Drive - Part 4"
    ],
    "Objectives": [
        {
            "ID": 1,
            "Required": true,
            "Location": "lighthouse",
            "LocationBoxTopLeft": [
                0,
                0
            ],
            "LocationBoxBottomRight": [
                0,
                0
            ],
            "Type": "eliminate",
            "Time": [
                0.0,
                0.0
            ],
            "Target": "PMCs using the specified AK-12",
            "Amount": 20
        }
    ],
    "Rewards": [
        {
            "Name": "xp",
            "Amount": 35300
        },
        {
            "Name": "Prapor rep",
            "Amount": 0.02
        },
        {
            "Name": "Roubles",
            "Amount": 400000
        },
        {
            "Name": "RPK-16",
            "Amount": 1
        },
        {
            "Name": "AK-74 60 round magazine",
            "Amount": 4
        },
        {
            "Name": "545x39 7N40 ammo pack (30 rounds)",
            "Amount": 8
        }
    ]
}
