{
    "QuestName": "Hell On Earth - Part 1",
    "Locations": [
        "any"
    ],
    "Kappa": false,
    "LeadsTo": [
        "Hell On Earth - Part 2"
    ],
    "Requirements": {
        "Level": 1,
        "Quests": [
            "The Good Times - Part 1"
        ]
    },
    "Objectives": [
        {
            "ID": 1,
            "Required": true,
            "Location": "any",
            "LocationBoxTopLeft": [
                0,
                0
            ],
            "LocationBoxBottomRight": [
                0,
                0
            ],
            "Type": "modify",
            "Time": [
                0.0,
                0.0
            ],
            "Target": "MP-43-1C",
            "Amount": 1
        }
    ],
    "Rewards": [
        {
            "Name": "xp",
            "Amount": 15600
        },
        {
            "Name": "Prapor rep",
            "Amount": 0.01
        },
        {
            "Name": "roubles",
            "Amount": 35700
        },
        {
            "Name": "NPP KIASS body armor",
            "Amount": 2
        }
    ]
}
