{
    "QuestName": "The Punisher - Part 4",
    "Locations": [
        "any"
    ],
    "Kappa": true,
    "LeadsTo": [
        "The Punisher - Part 5",
        "Kings Of The Rooftops"
    ],
    "Requirements": {
        "Level": 20,
        "Quests": [
            "The Punisher - Part 3"
        ]
    },
    "Objectives": [
        {
            "ID": 1,
            "Required": true,
            "Location": "lighthouse",
            "LocationBoxTopLeft": [
                0,
                0
            ],
            "LocationBoxBottomRight": [
                0,
                0
            ],
            "Type": "elimination",
            "Time": [
                0.0,
                0.0
            ],
            "Target": "scavs using an 12ga shotgun",
            "Amount": 10
        },
        {
            "ID": 2,
            "Required": true,
            "Location": "lighthouse",
            "LocationBoxTopLeft": [
                0,
                0
            ],
            "LocationBoxBottomRight": [
                0,
                0
            ],
            "Type": "elimination",
            "Time": [
                0.0,
                0.0
            ],
            "Target": "PMCs wearing a balaclava and scav vest",
            "Amount": 10
        },
        {
            "ID": 3,
            "Required": true,
            "Location": "any",
            "LocationBoxTopLeft": [
                0,
                0
            ],
            "LocationBoxBottomRight": [
                0,
                0
            ],
            "Type": "fir",
            "Time": [
                0.0,
                0.0
            ],
            "Target": "Bars A-2607 95Kh18 knive",
            "Amount": 5
        }
    ],
    "Rewards": [
        {
            "Name": "xp",
            "Amount": 18000
        },
        {
            "Name": "Prapor rep",
            "Amount": 0.03
        },
        {
            "Name": "Roubles",
            "Amount": 100000
        },
        {
            "Name": "M4A1 SOPMOD II",
            "Amount": 1
        }
    ]
}
