{
    "QuestName": "Shooting Cans",
    "Locations": [
        "ground_zero"
    ],
    "Kappa": true,
    "LeadsTo": [
        "Debut",
        "The Good Times - Part 1"
    ],
    "Requirements": {
        "Level": 1
    },
    "Objectives": [
        {
            "ID": 1,
            "Required": true,
            "Location": "ground_zero",
            "LocationBoxTopLeft": [
                408,
                467
            ],
            "LocationBoxBottomRight": [
                443,
                487
            ],
            "Type": "scout",
            "Time": [
                0.0,
                0.0
            ],
            "Target": "the Utyos machine gun",
            "Amount": 0
        },
        {
            "ID": 2,
            "Required": true,
            "Location": "ground_zero",
            "LocationBoxTopLeft": [
                316,
                671
            ],
            "LocationBoxBottomRight": [
                363,
                708
            ],
            "Type": "scout",
            "Time": [
                0.0,
                0.0
            ],
            "Target": "the AGS grenade launcher",
            "Amount": 0
        },
        {
            "ID": 3,
            "Required": true,
            "Location": "ground_zero",
            "LocationBoxTopLeft": [
                0,
                0
            ],
            "LocationBoxBottomRight": [
                0,
                0
            ],
            "Type": "elimination",
            "Time": [
                0.0,
                0.0
            ],
            "Target": "targets",
            "Amount": 5
        }
    ],
    "Rewards": [
        {
            "Name": "xp",
            "Amount": 1600
        },
        {
            "Name": "Prapor rep",
            "Amount": 0.01
        },
        {
            "Name": "roubles",
            "Amount": 13000
        },
        {
            "Name": "Mosin infantry",
            "Amount": 1
        },
        {
            "Name": "7.62x54R FMJ ammo pack (20 rounds)",
            "Amount": 3
        }
    ]
}
