{
    "QuestName": "Sanitary Standards - Part 2",
    "Locations": [
        "any"
    ],
    "Kappa": true,
    "LeadsTo": [
        "Painkiller"
    ],
    "Requirements": {
        "Level": 8,
        "Quests": [
            "Sanitary Standards - Part 1"
        ]
    },
    "Objectives": [
        {
            "ID": 1,
            "Required": true,
            "Location": "any",
            "LocationBoxTopLeft": [
                0,
                0
            ],
            "LocationBoxBottomRight": [
                0,
                0
            ],
            "Type": "fir",
            "Time": [
                0.0,
                0.0
            ],
            "Target": "gas analyzer",
            "Amount": 2
        }
    ],
    "Rewards": [
        {
            "Name": "xp",
            "Amount": 4500
        },
        {
            "Name": "Therapist rep",
            "Amount": 0.03
        },
        {
            "Name": "Roubles",
            "Amount": 30000
        },
        {
            "Name": "Propital",
            "Amount": 1
        }
    ]
}
