{
    "QuestName": "debut",
    "Locations": [
        "any"
    ],
    "Kappa": true,
    "LeadsTo": [
        "search mission",
        "luxurious life"
    ],
    "Requirements": {
        "Level": 0,
        "Quests": [
            "shooting cans"
        ] 
    },
    "Objectives": [
        {
            "Required": true,
            "Location": "any",
            "LocationBoxTopLeft": [
                0,
                0
            ],
            "LocationBoxBottomRight": [
                0,
                0
            ],
            "Type": "elimination",
            "Time": [
                0.0,
                0.0
            ],
            "Target": "scav",
            "Amount": 5
        },
        {
            "Required": true,
            "Location": "any",
            "LocationBoxTopLeft": [
                0,
                0
            ],
            "LocationBoxBottomRight": [
                0,
                0
            ],
            "Type": "gather",
            "Time": [
                0.0,
                0.0
            ],
            "Target": "MP-133",
            "Amount": 2
        }

    ],
    "Rewards": [
        {
            "Name": "xp",
            "Amount": 1700
        },
        {
            "Name": "Prapor rep",
            "Amount": 0.02
        },
        {
            "Name": "Jaeger rep",
            "Amount": 0.01
        },
        {
            "Name": "Roubles",
            "Amount": 15000
        },
        {
            "Name": "PP-91 Kedr",
            "Amount": 1
        },
        {
            "Name": "9x18 PM BZhT gzh ammo pack (50 rounds)",
            "Amount": 2
        },
        {
            "Name": "Purchase AKS-74UB at Prapor lvl 1",
            "Amount": 1
        }
    ]
}
