{
    "QuestName": "The Punisher - Part 6",
    "Locations": [
        "any"
    ],
    "Kappa": true,
    "LeadsTo": [
        "Capturing Outposts",
        "Intimidator",
        "Escort",
        "The Choice",
        "Gendarmerie - Mall Cop",
        "Best Job In The World"
    ],
    "Requirements": {
        "Level": 21,
        "Quests": [
            "The Punisher - Part 5"
        ]
    },
    "Objectives": [
        {
            "ID": 1,
            "Required": true,
            "Location": "any",
            "LocationBoxTopLeft": [
                0,
                0
            ],
            "LocationBoxBottomRight": [
                0,
                0
            ],
            "Type": "elimination",
            "Time": [
                0.0,
                0.0
            ],
            "Target": "PMCs using an SVD (not on factory)",
            "Amount": 15
        },
        {
            "ID": 2,
            "Required": true,
            "Location": "any",
            "LocationBoxTopLeft": [
                0,
                0
            ],
            "LocationBoxBottomRight": [
                0,
                0
            ],
            "Type": "fir",
            "Time": [
                0.0,
                0.0
            ],
            "Target": "BEAR dogtags",
            "Amount": 7
        },
        {
            "ID": 3,
            "Required": true,
            "Location": "any",
            "LocationBoxTopLeft": [
                0,
                0
            ],
            "LocationBoxBottomRight": [
                0,
                0
            ],
            "Type": "fir",
            "Time": [
                0.0,
                0.0
            ],
            "Target": "USEC Dogtags",
            "Amount": 7
        }
    ],
    "Rewards": [
        {
            "Name": "xp",
            "Amount": 19400
        },
        {
            "Name": "Prapor rep",
            "Amount": 0.04
        },
        {
            "Name": "Therapist rep",
            "Amount": 0.05
        },
        {
            "Name": "Skier rep",
            "Amount": 0.01
        },
        {
            "Name": "Roubles",
            "Amount": 250000
        },
        {
            "Name": "Secure container epsilon",
            "Amount": 1
        },
        {
            "Name": "purchase of 7.62x54mm R PS gzh at Prapor lvl 4",
            "Amount": 1
        }
    ]
}
