{
    "QuestName": "The Good Times - Part 1",
    "Locations": [
        "factory"
    ],
    "Kappa": false,
    "LeadsTo": [
        "Quality Standard",
        "Hell On Earth - Part 1"
    ],
    "Requirements": {
        "Level": 27,
        "Quests": [
            "Shooting Cans"
        ]
    },
    "Objectives": [
        {
            "ID": 1,
            "Required": true,
            "Location": "factory",
            "LocationBoxTopLeft": [
                0,
                0
            ],
            "LocationBoxBottomRight": [
                0,
                0
            ],
            "Type": "elimination",
            "Time": [
                0.0,
                0.0
            ],
            "Target": "PMCs using the specified equipment",
            "Amount": 10
        }
    ],
    "Rewards": [
        {
            "Name": "xp",
            "Amount": 76000
        },
        {
            "Name": "Prapor rep",
            "Amount": 0.03
        },
        {
            "Name": "roubles",
            "Amount": 256000
        },
        {
            "Name": "M1A",
            "Amount": 1
        },
        {
            "Name": "M1A 20 round magazine",
            "Amount": 2
        },
        {
            "Name": "7.62x51 M62 ammo pack (20 rounds)",
            "Amount": 3
        }
    ]
}
