{
    "QuestName": "Background Check",
    "Locations": [
        "Customs"
    ],
    "Kappa": true,
    "LeadsTo": [
        "Shootout Picnic",
        "Delivery From the Past"
    ],
    "Requirements": {
        "Level": 0,
        "Quests": [
            "Luxurious Life"
        ],
        "Items": [
            "Machinery Key"
        ]
    },
    "Objectives": [
        {
            "Required": true,
            "Location": "Customs",
            "LocationBoxTopLeft": [
                0,
                0
            ],
            "LocationBoxBottomRight": [
                0,
                0
            ],
            "Type": "Fetch",
            "Time": [
                0.0,
                0.0
            ],
            "Target": "Bronze Pocket Watch",
            "Amount": 1
        }
    ],
    "Rewards": [
        {
            "Name": "xp",
            "Amount": 1800
        },
        {
            "Name": "Prapor rep",
            "Amount": 0.03
        },
        {
            "Name": "Roubles",
            "Amount": 15000
        },
        {
            "Name": "SKS carbine",
            "Amount": 1
        },
        {
            "Name": "7.62x39 FMJ ammo pack (20 rounds)",
            "Amount": 3
        }
    ]
}
